title,text,author,score,num_comments,url,timestamp,subreddit_id,subreddit
Here's to a hopefully much shorter year.,[deleted],,16,6,https://www.reddit.com/r/SuicideWatch/comments/abctbv/heres_to_a_hopefully_much_shorter_year/,12/31/2018/23:56:21,abctbv,SuicideWatch
I tried to kill myself,[deleted],,3,3,https://www.reddit.com/r/SuicideWatch/comments/abctal/i_tried_to_kill_myself/,12/31/2018/23:56:14,abctal,SuicideWatch
"I feel like I’m gonna do it tonight. New year, new me, right?","Title pretty much says it all. The parents are gonna be gone for a few hours with their friends for New Years Eve, so I have the house to myself. I just don’t want to see another year. Experience the same shit as 2018. My whole life has just been one shit storm after another and I don’t want to do it again. 

The pain feels too big.",emthegem12,11,3,https://www.reddit.com/r/SuicideWatch/comments/abcss8/i_feel_like_im_gonna_do_it_tonight_new_year_new/,12/31/2018/23:54:41,abcss8,SuicideWatch
the idea of me living anyone year is super depressing to me,,radicallysadbro,12,4,https://www.reddit.com/r/SuicideWatch/comments/abcrm0/the_idea_of_me_living_anyone_year_is_super/,12/31/2018/23:51:03,abcrm0,SuicideWatch
Heres to spending new years alone,[deleted],,4,4,https://www.reddit.com/r/SuicideWatch/comments/abcrg9/heres_to_spending_new_years_alone/,12/31/2018/23:50:33,abcrg9,SuicideWatch
Why,"How can I kill myself without ruining my children’s life? 
I have NO will to live at all. 
Not one thing.   I am so jealous when I hear someone has died. ",Sucksinnc,35,26,https://www.reddit.com/r/SuicideWatch/comments/abcn70/why/,12/31/2018/23:37:42,abcn70,SuicideWatch
"My marriage is falling apart, I might lose my job in a week and my mental illness and feelings of isolation from friends and family are by far the worst they've ever been.",[deleted],,9,6,https://www.reddit.com/r/SuicideWatch/comments/abcl9q/my_marriage_is_falling_apart_i_might_lose_my_job/,12/31/2018/23:32:12,abcl9q,SuicideWatch
No one cares about me.,[deleted],,5,1,https://www.reddit.com/r/SuicideWatch/comments/abcl04/no_one_cares_about_me/,12/31/2018/23:31:24,abcl04,SuicideWatch
I think my gf killed her self,[deleted],,4,10,https://www.reddit.com/r/SuicideWatch/comments/abcjcu/i_think_my_gf_killed_her_self/,12/31/2018/23:26:38,abcjcu,SuicideWatch
Happy new year everyone,[removed],DerErnst,8,2,https://www.reddit.com/r/SuicideWatch/comments/abchum/happy_new_year_everyone/,12/31/2018/23:22:14,abchum,SuicideWatch
I’m so tired,"I’m tired of fighting, I’m exhausted, God why does life hurt so bad? I just forced myself to leave my carport. It sounds so peaceful to let go and die from carbon monoxide poisoning. I can’t do that to my dog. I’m just so damn tired.",Kalehead007,6,2,https://www.reddit.com/r/SuicideWatch/comments/abchs0/im_so_tired/,12/31/2018/23:22:01,abchs0,SuicideWatch
Rant(m21),"I have a holiday coming up but after it I really feel like killing myself. Im 21 qnd a guy ans j have no friends or girlfriend(and never have and never will). I am ugly and feel intense social anxiety as well and depression. I see static all the time and have visual snow. I feel different from others and have always been socially awkward and isolated. I dont feel like I can have a normal life. All my friends are gone. I can sense it now, when someone isn't interested in a friendship in the same way i am, and when I pull away the friendship is over because it was always me that was initiating contact. They must have other friends they value more and have more fun with but i really valued being around themm. The only thing I enjoy is lifting weights and going to the gym, but thats not enough for a happy functional life. I genuinely want to die and thought about hanging myaeld every day for at least the last month( i journal now). 

The funny thing is, whayever people szy nkrmally doesnt help because i dont relate to people. I struggle to understand what they are saying or why they are feeling certain ways. Therapy feels uncomfortable because im shit at talking and expressing my feelings, i also lie about it because itz very sensitive. That's basically what im struggling with.",sbdmane,1,1,https://www.reddit.com/r/SuicideWatch/comments/abchc6/rantm21/,12/31/2018/23:20:46,abchc6,SuicideWatch
Hi,[deleted],,3,4,https://www.reddit.com/r/SuicideWatch/comments/abcfdi/hi/,12/31/2018/23:15:04,abcfdi,SuicideWatch
Fuck it man,"I mean, why not? I’m at negative 3 billion resources in all areas. There’s no coming out, ever. 

It would be way better to be fucking dead dude. ",Psychological_Meet,2,1,https://www.reddit.com/r/SuicideWatch/comments/abcdz2/fuck_it_man/,12/31/2018/23:11:02,abcdz2,SuicideWatch
How am I supposed to cope. Watching my wife's Facebook feed on New Years.,"Christmas was hard enough, but this is killing me.

My wife of 25 years left me two months ago. Spent a night with somebody she works with, and dumped me by text when I was away visiting family on my birthday. She's been secretive about her phone for a long time and is occasionally alcohol dependent and abusive. She has new male admirers flocking round her and is flaunting her new happy life on Facebook and posting things like ""She left her old life and stepped into her new life"" on Instagram.

I messaged her that I was really struggling earlier and got a reply that was just ""there is nothing to say"".

I don't know what I'm supposed to do. I'm nearly 50. I've been with her for more than half my life. I feel dead. There isn't a moment when I am not thinking of her and what she's doing.

How do I go on? There is nothing left that is me. At what point do I just admit defeat?",zzubnik,5,5,https://www.reddit.com/r/SuicideWatch/comments/abcb7r/how_am_i_supposed_to_cope_watching_my_wifes/,12/31/2018/23:02:51,abcb7r,SuicideWatch
HNY,"Cant believe I will make it until 2019.
Honestly, I had set a date to kill myself, which is yesterday.
It was such a bumpy ride with all the things happened and the insecurity of mine make it worst. I really really reallyyy want to start cutting again. The urge is stronger than before but I manage to held it back because I dont want people to see my scars. Theyre not pretty but its inspiring for me. Let see how long I can make it in 2019. ",toliee,3,1,https://www.reddit.com/r/SuicideWatch/comments/abc8mn/hny/,12/31/2018/22:55:09,abc8mn,SuicideWatch
[UPDATE] I'm going to federal prison because of amazon,So Amazon just refunded me and they didn't do anything. I dunno why they said they would. So I bought the game again. ,fraudsuicide,0,1,https://www.reddit.com/r/SuicideWatch/comments/abc5nt/update_im_going_to_federal_prison_because_of/,12/31/2018/22:45:57,abc5nt,SuicideWatch
happy new year to all,"2019's in an hour and i'm not dead yet. i recommend y'all stick around as well, shit's gonna be interesting.",callowedbethyname,8,4,https://www.reddit.com/r/SuicideWatch/comments/abc3tk/happy_new_year_to_all/,12/31/2018/22:40:12,abc3tk,SuicideWatch
I think this is it,"Idk how much detail I'm gonna go through on this post, I never thought I'd be here
For the past few months my life has gone to shit. I've lost all my friends, the only friend I have left I have a hopeless crush on and I won't sy anything because I'm too scared to lost my last friend. My family hate me because I do drugs and a lot of lsd recently has made me realise how fucked I am
I don't understand my own, or others, emotions and it really plays with me and everything is way too much and I can't take it anymore
I'm going to kill myself tonight, I doubt my friend will see this but if they do I love you",Good_bye_internet,3,10,https://www.reddit.com/r/SuicideWatch/comments/abc3lx/i_think_this_is_it/,12/31/2018/22:39:31,abc3lx,SuicideWatch
Fuck this. Another year of either being ignored and being abused,We shouldn't stand for this anymore. ,Mortuumbra,5,3,https://www.reddit.com/r/SuicideWatch/comments/abc3ln/fuck_this_another_year_of_either_being_ignored/,12/31/2018/22:39:29,abc3ln,SuicideWatch
A b o u t _ S u i c i d e,[removed],lampheart,0,5,https://www.reddit.com/r/SuicideWatch/comments/abc2r7/a_b_o_u_t_s_u_i_c_i_d_e/,12/31/2018/22:36:52,abc2r7,SuicideWatch
The end of one painful year and the start of another,"I can't go on anymore ,I won't go on anymore .people says its gets better they say it will be ok in the end ,all liars. Goodbye ,2018 will be be my last year of pain 
",Aloneboy2019,9,33,https://www.reddit.com/r/SuicideWatch/comments/abc2qd/the_end_of_one_painful_year_and_the_start_of/,12/31/2018/22:36:46,abc2qd,SuicideWatch
I think this might be it,I think this might be it or at least sometime in the next few days i have a therapy session booked in a few days but ido if I can make it I’ve been cutting a lot recently and maybe that’s how I end it I haven’t figured it out yet I don’t want my family to be the ones to find me but idk if I can continue ,throwaway948476473,4,1,https://www.reddit.com/r/SuicideWatch/comments/abc1xi/i_think_this_might_be_it/,12/31/2018/22:34:23,abc1xi,SuicideWatch
It's so hard having to hide my true emotions and mental to my family,"I always hide how i really feel to my family cause i don't want them to worry about me.

I'm now currently having dinner with my family in the new years eve, I'm broken inside and i only want to cry but I'm there pretending to be happy and talking with them like that wojak who's crying but hiding it with a smiling face mask. I have to make short breaks every 15 minutes because i feel like i can't hold my tears and the pain is killing me. I constantly think about killing myself but i know I'm a fucking pussy and probably will never do it and keep suffering silently.

Christmas should be for enjoying it and being happy and yet here i am like a sad boy wanting to die. Feeling lonely is so painful, I'm a fucking 20 years old loser and a loner, don't have friends, gf or any of that stuff, and then there's my little cousin (13 years old) going out with his friends almost everyday, goes to parties every weekend and probably hanging out with girls too. I want to die, wish you a happy new year but i bet that for most of us it will be as bad as 2018.",Your_friendly_medic,7,1,https://www.reddit.com/r/SuicideWatch/comments/abc0uo/its_so_hard_having_to_hide_my_true_emotions_and/,12/31/2018/22:31:23,abc0uo,SuicideWatch
That time of the year...,[deleted],,1,7,https://www.reddit.com/r/SuicideWatch/comments/abc0id/that_time_of_the_year/,12/31/2018/22:30:19,abc0id,SuicideWatch
no 2019,all i can think about is dieing here n now i just want 2 slit my wrists take a lots of tablets n die,gembee1,9,9,https://www.reddit.com/r/SuicideWatch/comments/abc0bt/no_2019/,12/31/2018/22:29:54,abc0bt,SuicideWatch
With Friends,I see some people here genuinely alone and I feel guilty for being depressed when I'm not alone. I'm sat in a room with my fiancée and two of my friends and I just feel so alone and miserable and I feel like I just can't another year of all the struggles I've faced so far this year.,CraKaJAQ,4,2,https://www.reddit.com/r/SuicideWatch/comments/abbzsc/with_friends/,12/31/2018/22:28:20,abbzsc,SuicideWatch
Why is it like this?,"Why is it this way? Stuff around me is going well, amazing girlfriend, really caring grandparents, i'm in college, have a home to live in, physically im well. but yet I still feel so fucking shit, my heads so fucked I actually hate it so much, I don't even know why i'm making the post literally just to vent I guess, idk tbh. I have psychosis symptoms and am really depressed and I fucking hate it so much. I literally just wanna make my girlfriend happy and be able to live a nice amazing life with her. i'm sat here like a complete fucking loser, all alone crying on new years eve. Nice one. i'm actually so useless jesus christ. Nothings even happened im just so fucking down and I hate it so much and just want it to go, it actually feels like i'm being absorbed or that im fucking drowning in this unexplainable, horrible feeling. ",LilLilTremz,2,14,https://www.reddit.com/r/SuicideWatch/comments/abbyks/why_is_it_like_this/,12/31/2018/22:24:30,abbyks,SuicideWatch
I’m incredibly lonely and probably always will be. It’s agonizing to live this way.,"Long story short, I’m too scared to reach out and have meaningful relationships. I have a mental illness of some damn sort that I don’t know how to identify quite correctly that makes me so afraid of genuine human interaction and letting people in. My codependency and trauma have me trapped in an abusive relationship I don’t know how to get out of. Ive lost my friends because of this and I can’t pretend to feign a relationship with my family anymore. I fake who I am and what I feel every day. I can’t show anyone the real me, or even a fake me most days without enormous effort, not even to internet strangers. I’d love to even have internet friends but it’s terrifying to even post here. It’s been like this my whole life and I don’t know how to stop. I’ve been in therapy so often and tried different pills. I can feel that nobody gives a shit about me, not really anyway, and it’s all my fault because I don’t let them. I don’t know when it will end. I don’t know what it takes to stop it. I know it’s all my fault in the end, but I just don’t have the willpower to try anymore.

A person can’t live like this. Human beings need other people, it’s just how we’re wired. And I can’t live like this as a functioning adult with a job. I think I’ve been doomed from the start. ",alamhigo,16,5,https://www.reddit.com/r/SuicideWatch/comments/abbt32/im_incredibly_lonely_and_probably_always_will_be/,12/31/2018/22:07:45,abbt32,SuicideWatch
I really want to die tonight,"It's... a difficult evening.

Take care of you all. 

Hope you'll get better and finally have better evening someday if you're browsing this sub.",throwaway23111996,108,18,https://www.reddit.com/r/SuicideWatch/comments/abbsjo/i_really_want_to_die_tonight/,12/31/2018/22:06:04,abbsjo,SuicideWatch
I work on the top floor of a warehouse.,Its a platform only guarded by a small rail. I've had daily suicidal thoughts for a decade but this only worsens it. I actually was about to put my leg over today until I saw a coworker turn the corner. Sometimes I feel like I belong in a mental institute. My mind is so fucked. I feel hopeless even after becoming vocal of my issues with people that seemingly cared. My family just brushes it off like its nothing. Maybe I should jump so they can see that there was indeed something wrong with me.,DGeriNegative,18,7,https://www.reddit.com/r/SuicideWatch/comments/abbs0c/i_work_on_the_top_floor_of_a_warehouse/,12/31/2018/22:04:30,abbs0c,SuicideWatch
I have been thinking about ending my life,I have 49 Vistaril and 16 Seroquel that I can take.  ,TheCure1818,8,13,https://www.reddit.com/r/SuicideWatch/comments/abbrs7/i_have_been_thinking_about_ending_my_life/,12/31/2018/22:03:52,abbrs7,SuicideWatch
I Can't Take It Anymore,"I can't take it anymore. This whole year I've been trampled on, disrespected, everything. No one even invited me for New years.

I feel sad, alone and abandoned even by my SO and I feel like I'm stuck in a dark hopeless pit and I just can't take it anymore. I am contemplating just ending it.",ShadowRade,3,1,https://www.reddit.com/r/SuicideWatch/comments/abbpn3/i_cant_take_it_anymore/,12/31/2018/21:57:25,abbpn3,SuicideWatch
Messenger group,"Is anybody interested in creating a group chat to make it easier to communicate with each other, exchange opinions and send messages?",panawayne,4,5,https://www.reddit.com/r/SuicideWatch/comments/abbog0/messenger_group/,12/31/2018/21:53:33,abbog0,SuicideWatch
Happy new year to all of you,[removed],Campoutor,34,5,https://www.reddit.com/r/SuicideWatch/comments/abbn9i/happy_new_year_to_all_of_you/,12/31/2018/21:49:47,abbn9i,SuicideWatch
I'm just trying,[deleted],,5,1,https://www.reddit.com/r/SuicideWatch/comments/abbmqr/im_just_trying/,12/31/2018/21:48:09,abbmqr,SuicideWatch
I took two tabs of LSD last night and almost killed myself last night.,[deleted],,10,10,https://www.reddit.com/r/SuicideWatch/comments/abbmf5/i_took_two_tabs_of_lsd_last_night_and_almost/,12/31/2018/21:47:11,abbmf5,SuicideWatch
I'm beginning to seriously fantasise about suicide.,[deleted],,1,1,https://www.reddit.com/r/SuicideWatch/comments/abbl9n/im_beginning_to_seriously_fantasise_about_suicide/,12/31/2018/21:43:42,abbl9n,SuicideWatch
"New years, alone and hanging by a thread",[deleted],,4,1,https://www.reddit.com/r/SuicideWatch/comments/abbjkv/new_years_alone_and_hanging_by_a_thread/,12/31/2018/21:38:29,abbjkv,SuicideWatch
Is this hell/purgatory?,[deleted],,3,3,https://www.reddit.com/r/SuicideWatch/comments/abbb38/is_this_hellpurgatory/,12/31/2018/21:11:52,abbb38,SuicideWatch
Theres a new post every minute,"So I dont expect this to even be seen. Theres just so many posts. So many of us hirting. Fuck the new year. Fuck 2018. I should not have fucking survived new year. I can't keep going. Everybody around me knows, it's not like it's a secret. 'Reach out' I tried that. This year I'm not. This year I won't survive.  

",endofthegame,114,24,https://www.reddit.com/r/SuicideWatch/comments/abb8sg/theres_a_new_post_every_minute/,12/31/2018/21:04:34,abb8sg,SuicideWatch
My last day,"I think I’ve gone crazy, I’m in deep depression. I’ve tried hanging myself but I always end up falling off. I’ve tried slicing my neck but the knives are too dull. I’m going to stand in front of a train tonight. Nobody listens, I’ve written a note. Goodbye.",sircretino,10,12,https://www.reddit.com/r/SuicideWatch/comments/abb7ta/my_last_day/,12/31/2018/21:01:51,abb7ta,SuicideWatch
Its been a tough year for all of us.,[removed],evilspells,10,2,https://www.reddit.com/r/SuicideWatch/comments/abb65y/its_been_a_tough_year_for_all_of_us/,12/31/2018/20:56:50,abb65y,SuicideWatch
I told myself I don't want to see 2019,I really can't take another year like this. But I think I'm to dumb to understand what today is and to lethargic to do anything ,feliimena,20,7,https://www.reddit.com/r/SuicideWatch/comments/abb5vc/i_told_myself_i_dont_want_to_see_2019/,12/31/2018/20:55:53,abb5vc,SuicideWatch
happy new year! i really feel depressed,[deleted],,9,4,https://www.reddit.com/r/SuicideWatch/comments/abb33q/happy_new_year_i_really_feel_depressed/,12/31/2018/20:47:28,abb33q,SuicideWatch
i want to die but not kill myself,[deleted],,10,1,https://www.reddit.com/r/SuicideWatch/comments/abb2lr/i_want_to_die_but_not_kill_myself/,12/31/2018/20:45:57,abb2lr,SuicideWatch
I wanted to kill myself today but i couldn't carry through it,This week has been the most painful in my entire life. I never felt so much pain and despair and confusion as much as i have in this holiday week. I had a perfect plan. The materials i needed. The perfect location. One thing was missing. It was the same thing that i lacked that drove me to want me to kill myself in the first place and that was Courage. I have so many overwhelming reasons to end my life but the thought of those left behind ate me up in the most tortuous kind of way. I still want to die i feel nothing but powerlessness and despair most of the days but i just cant i fucking cant. Suicide is horrible no matter how attractive it seems it doesnt change the fact that its horrible. To anyone struggling today im with you and i completely understand Lets just hope we make it through ❤,OOLLMM,5,2,https://www.reddit.com/r/SuicideWatch/comments/abb2c4/i_wanted_to_kill_myself_today_but_i_couldnt_carry/,12/31/2018/20:45:12,abb2c4,SuicideWatch
Today is a good opportunity to recycle my atoms and put them to better use.,"Today is a good opportunity to recycle my atoms and put them to better use. This morning I went out hiking deep into the forest and setup my noose in a tree. Just been meditating for a bit first. 

I don’t know how certain the future is. I come from a day trading background. Past performance does not necessarily indicate future prospects. But not having had the opportunity to have a girlfriend yet makes me think this is highly likely to continue based on my technical & fundamental analysis.",GodAtum,7,2,https://www.reddit.com/r/SuicideWatch/comments/abaquj/today_is_a_good_opportunity_to_recycle_my_atoms/,12/31/2018/20:10:17,abaquj,SuicideWatch
Is that time of the year when I think i'm finally going to do it and then...,"I chicken out 😞

Man, offing yourself is not fucking easy... ",ThrowawayLikeMeLife,51,12,https://www.reddit.com/r/SuicideWatch/comments/abap4r/is_that_time_of_the_year_when_i_think_im_finally/,12/31/2018/20:05:12,abap4r,SuicideWatch
"Does anybody actually wake up every day thinking ""wow I can't wait for another one""?","It's just day after day of agony, I can't comprehend that people actually enjoy it.",Ninja_Vanish_Account,237,51,https://www.reddit.com/r/SuicideWatch/comments/abakkt/does_anybody_actually_wake_up_every_day_thinking/,12/31/2018/19:52:02,abakkt,SuicideWatch
2018 sucked,[removed],rayraybakery231,178,40,https://www.reddit.com/r/SuicideWatch/comments/abakji/2018_sucked/,12/31/2018/19:51:57,abakji,SuicideWatch
It's so sad on how there's so many people that need help during this time,[removed],SynthTee,53,18,https://www.reddit.com/r/SuicideWatch/comments/abahf0/its_so_sad_on_how_theres_so_many_people_that_need/,12/31/2018/19:42:53,abahf0,SuicideWatch
My life is absolute shit.,[deleted],,6,2,https://www.reddit.com/r/SuicideWatch/comments/abag2w/my_life_is_absolute_shit/,12/31/2018/19:38:50,abag2w,SuicideWatch
Szondi test,[removed],ouun,1,0,https://www.reddit.com/r/SuicideWatch/comments/abaeo0/szondi_test/,12/31/2018/19:34:42,abaeo0,SuicideWatch
"Almost ended my life in 2018, what steps can I take to stop that from happening in 2019?",,Yoshiverse4,7,11,https://www.reddit.com/r/SuicideWatch/comments/abadr9/almost_ended_my_life_in_2018_what_steps_can_i/,12/31/2018/19:32:07,abadr9,SuicideWatch
"Trust me, there is no solution",[deleted],,6,15,https://www.reddit.com/r/SuicideWatch/comments/ababc9/trust_me_there_is_no_solution/,12/31/2018/19:25:05,ababc9,SuicideWatch
My uncle,[removed],vinnie1132,0,0,https://www.reddit.com/r/SuicideWatch/comments/abab7z/my_uncle/,12/31/2018/19:24:43,abab7z,SuicideWatch
Im a fucking idiot,I'm a photographer and I was supposed to work last night for a night club but I got super anxious and took way too much lyrica and missed the job and I am so mad at myself I just wanna neck tbh ,clo-ve,11,3,https://www.reddit.com/r/SuicideWatch/comments/abaakp/im_a_fucking_idiot/,12/31/2018/19:22:49,abaakp,SuicideWatch
This is the end for me there is no next year....,[deleted],,4,3,https://www.reddit.com/r/SuicideWatch/comments/aba943/this_is_the_end_for_me_there_is_no_next_year/,12/31/2018/19:18:30,aba943,SuicideWatch
2019 is not somewhere I want to be.,"i spent the whole of 2018 contemplating my own death. i do not think i can recall a single hour where one thought didn't infect my mind and i was free. i'm done and i am not spending another year through this. i've spoke to people, i've went to services, shit doesn't work. i just have a weird stigma around me now which i have to fight with when i think about death. i don't know why i believed when people said to me 'just keep persevering' throughout the year when i know fine well my own capabilities. i won't allow myself to suffer for another year just to appease those who want me to stay in this world. 2019 is not somewhere i want to be. im young. i don't want to experience the next 30 depressing and demoralising chapters of my life and i won't let myself do so either.
if anyone has anything other than what i have heard a million times, that'd be great right now.",Sawbaws,17,6,https://www.reddit.com/r/SuicideWatch/comments/aba8ol/2019_is_not_somewhere_i_want_to_be/,12/31/2018/19:17:12,aba8ol,SuicideWatch
It’s too much,[deleted],,11,5,https://www.reddit.com/r/SuicideWatch/comments/aba81e/its_too_much/,12/31/2018/19:15:17,aba81e,SuicideWatch
I'm the worst person I know.,"I feel so fucking guilty for existing. I need to kill myself before I hurt more people.

I've been planning a suicide for tonight for the past few months, but I can't do that to my family. Not during the holiday season. So I have to wait another week or so before I can go through with my plan. I made plans for the week so I can see my loved ones one last time. But what if I hurt more people during the next few weeks while I'm waiting for the holiday spirit to die down? Maybe I should do it tonight.",beeopop,5,3,https://www.reddit.com/r/SuicideWatch/comments/aba810/im_the_worst_person_i_know/,12/31/2018/19:15:15,aba810,SuicideWatch
can someone please talk to me for a bit until I get the courage,[deleted],,5,2,https://www.reddit.com/r/SuicideWatch/comments/aba7lm/can_someone_please_talk_to_me_for_a_bit_until_i/,12/31/2018/19:14:10,aba7lm,SuicideWatch
You'll probably laugh at me but I figured I woukd vent here since I can't anywhere else,[deleted],,8,12,https://www.reddit.com/r/SuicideWatch/comments/aba3vm/youll_probably_laugh_at_me_but_i_figured_i_woukd/,12/31/2018/19:03:33,aba3vm,SuicideWatch
