title,text,author,score,num_comments,url,timestamp,subreddit_id,subreddit
Me and her will never be together so what is the point?,Human beings are so suppose to find a couple and be with someone. it feels good being with someone I know I will be forever lonely I don't see the point anymore except finding a gun or rope and ending it all..,pallbearer776,2,2,https://www.reddit.com/r/SuicideWatch/comments/ab3x38/me_and_her_will_never_be_together_so_what_is_the/,12/31/2018/04:59:54,ab3x38,SuicideWatch
"Uh, weirdo here, just, help, please","I don't actually feel so suicidal, as many people I see on this subreddit, but, I still feel quite a lot like it. Like, sure, I'm smarter than average, yet I always get into trouble with other people or with myself, mostly the last one, tbh. Like, should I be dead? I suffer from anxiety, depression and hiperactivity, and no matter what I do, it always feel like it's wrong, or not even worth it. Only things that matter to me at this point, part of my (social) anxiety, I think, are the effect my suicide would cause to people who surround me, my parents, my little sister, and my girlfriend, for the biggest part. I feel like everything would be better with me dead, but even me causing my own death would cause trouble for people, something I can't bear to think... I know there's something in me worth for living, but everything else makes it useless",k98mauserbyf43,3,2,https://www.reddit.com/r/SuicideWatch/comments/ab3w53/uh_weirdo_here_just_help_please/,12/31/2018/04:56:23,ab3w53,SuicideWatch
Are there any communities with people who are actually ready?,"I mean the fear of the moment or being too much of a coward to go through with it, but im speaking in general. Not people who want to vent and talk about their problems, but people who are committed and plan to do it. Where is a community or group of people like this",virginity000,1,2,https://www.reddit.com/r/SuicideWatch/comments/ab3vgy/are_there_any_communities_with_people_who_are/,12/31/2018/04:53:59,ab3vgy,SuicideWatch
I can't live with myself anymore.,[deleted],,2,2,https://www.reddit.com/r/SuicideWatch/comments/ab3tlq/i_cant_live_with_myself_anymore/,12/31/2018/04:47:10,ab3tlq,SuicideWatch
6 months to live,[deleted],,1,0,https://www.reddit.com/r/SuicideWatch/comments/ab3t9y/6_months_to_live/,12/31/2018/04:45:57,ab3t9y,SuicideWatch
New Year Blues,"Every new year, I tell myself to hold out one more year and list a ton of what-if b.s scanrios. And each year Ive cared less and less to listen myself. 

Have had suicidals thoughts since as far back as I can remember. Not sure why at the age of 8, I would cry for hours and try to suffocate myself with my blanket. 

Its not like I havent asked others for help either , like friends and family. It just gets brushed off or when I try to explain how I feel it feels inauthentic and makes me almost laugh. Anyone else?

I've always had this gut feeling, an intuition of sorts that I wont live past 25. I just hope its by some freak accident so I wont have my parent feeling guilty. 

Honestly the only reason Im ""alive"".

Oh well, got that of my chest.",bitmadly,3,0,https://www.reddit.com/r/SuicideWatch/comments/ab3re6/new_year_blues/,12/31/2018/04:39:04,ab3re6,SuicideWatch
i need motivation to work,"I can’t focus, i can only think about killing myself. ",annalimo,4,3,https://www.reddit.com/r/SuicideWatch/comments/ab3r8s/i_need_motivation_to_work/,12/31/2018/04:38:29,ab3r8s,SuicideWatch
One final attempt,[deleted],,1,0,https://www.reddit.com/r/SuicideWatch/comments/ab3pg2/one_final_attempt/,12/31/2018/04:32:16,ab3pg2,SuicideWatch
I feel like I have finally found out what my problems actually are,[deleted],,1,0,https://www.reddit.com/r/SuicideWatch/comments/ab3pb5/i_feel_like_i_have_finally_found_out_what_my/,12/31/2018/04:31:46,ab3pb5,SuicideWatch
I just need to put this into the universe.,[deleted],,2,1,https://www.reddit.com/r/SuicideWatch/comments/ab3oos/i_just_need_to_put_this_into_the_universe/,12/31/2018/04:29:36,ab3oos,SuicideWatch
Soon enough.,[deleted],,3,2,https://www.reddit.com/r/SuicideWatch/comments/ab3n9f/soon_enough/,12/31/2018/04:24:34,ab3n9f,SuicideWatch
Why do I always feel so calm after i was so close to doing it,[deleted],,4,1,https://www.reddit.com/r/SuicideWatch/comments/ab3j2r/why_do_i_always_feel_so_calm_after_i_was_so_close/,12/31/2018/04:09:47,ab3j2r,SuicideWatch
Help for other redditor,"Hello, I was diving into the nihilism subreddit and a guy there needs help, but I don’t believe I’m very qualified to do so. I didn’t want to directly link to his post since he could feel bad about such, so please search one of the first current posts in Hot for r/nihilism to see it.

Thanks in advance.",FreyjaOfFolkvangr,3,0,https://www.reddit.com/r/SuicideWatch/comments/ab3im9/help_for_other_redditor/,12/31/2018/04:08:13,ab3im9,SuicideWatch
Feel like ending it right now,That’s all,mikeyrocks202,3,2,https://www.reddit.com/r/SuicideWatch/comments/ab3hzj/feel_like_ending_it_right_now/,12/31/2018/04:05:57,ab3hzj,SuicideWatch
My parents make me suicidal,"Whenever I have an opinion my parents shut it down. They don't let me have a voice. When I speak they interrupt me and when I interrupt them they beat me up. Throughout the years I lost who I am, I'm numb to who I am. I don't know who I am, all I know is the pain my parents caused me. I never wanted to be a Computer Scientists, but I was too scared to tell them that now and now it's too late to change my mind. I read about a Google employee who hung himself and everyone was wondering why because he was ""very happy and had a good job,"" but that's me. I am always making jokes at school, people consider me to be the class clown. But I only do that to mask the pain within. Same was with him. Just because I smile doesn't mean I'm happy. Just because I say I want to do it doesn't mean I do. I feel like I no longer exist, like I am nobody. The only reason why I don't end it all right now is that I want to prove them wrong. But I don't know how, and every day I feel like its time to kill myself. I have reached out to some adults but they wouldn't listen to me and gave me the cliche ""don't be sad lol."" IDK what the fuck I am supposed to do. I don't have a phone to text the suicide hotline, and even if I did I don't feel comfortable talking to an adult. I want to talk to someone who has been through what I have. But IDK anyone who has.",Piggintins,16,13,https://www.reddit.com/r/SuicideWatch/comments/ab3hhk/my_parents_make_me_suicidal/,12/31/2018/04:04:13,ab3hhk,SuicideWatch
Cut myself profusely while drunk on my fathers birthday.,[deleted],,23,9,https://www.reddit.com/r/SuicideWatch/comments/ab3gs5/cut_myself_profusely_while_drunk_on_my_fathers/,12/31/2018/04:01:43,ab3gs5,SuicideWatch
Should i actually go through with this...,I am a 19 year old guy living in a homeless shelter. I was kicked out of CPS when I turned 18...I've been homeless for a year and 3 months now...I've had passed attempt before but none successful...I really have no reason to live due to me being so detached from the world...I have no friends or relatives that know I even exist...it would be pretty easy to end it but every time I get close I flake out...like I don't got the balls to do it...I'm thinking I should just use a gun cause there's not really a way to turn back once you pull the trigger...,yxngzazel,11,15,https://www.reddit.com/r/SuicideWatch/comments/ab3g6u/should_i_actually_go_through_with_this/,12/31/2018/03:59:47,ab3g6u,SuicideWatch
Tomorrow could be it,[deleted],,1,5,https://www.reddit.com/r/SuicideWatch/comments/ab3ah0/tomorrow_could_be_it/,12/31/2018/03:40:03,ab3ah0,SuicideWatch
Holidays make me feel depressed more than any type of period of the year.,[deleted],,1,1,https://www.reddit.com/r/SuicideWatch/comments/ab3a3a/holidays_make_me_feel_depressed_more_than_any/,12/31/2018/03:38:32,ab3a3a,SuicideWatch
"26 Aleve, maximum dose of 3",[deleted],,1,6,https://www.reddit.com/r/SuicideWatch/comments/ab37mg/26_aleve_maximum_dose_of_3/,12/31/2018/03:29:53,ab37mg,SuicideWatch
I hate my Mum so much.,"She's super unsupportive of me being trans, and always tells me how mentally ill I am. I've told her how much her deadnaming me makes me want to kill myself, but she persists in addressing me this way. What a great fucking parent. I want to run away to a foster home, but I'm worried she'd find me before I get there, or I get kidnapped by a pedo, or I starve to death, or any plethora of things preventing me from doing so. I don't want to commit suicide. I really don't. I just want to live with someone that isn't her. My only trans friend (who my Mum didn't make me cut ties with) offered to let me stay with him if things go so bad I have to run away, but my Mum could probably sue them if she found out (IDK about that kind of legal stuff) I was there. I need to get out of here. I've been packing up and trying to find a foster center near me, but I don't have any means of getting there. I mean, I'd probably die of starvation out there, but that's a better end than living with that witch I call my Mother. I hate her so much. She's ruining my fucking life. These are the lengths I'm willing to go to to get as far away from her as I possibly can. I doubt anyone can actually help me, I just have to talk to someone.",SociopathyKathy,1,1,https://www.reddit.com/r/SuicideWatch/comments/ab376k/i_hate_my_mum_so_much/,12/31/2018/03:28:21,ab376k,SuicideWatch
I will hurt someone for sure...,[deleted],,0,3,https://www.reddit.com/r/SuicideWatch/comments/ab36k1/i_will_hurt_someone_for_sure/,12/31/2018/03:26:14,ab36k1,SuicideWatch
Is finding love a reason to continue living? Is love really worth it?,"I’ve tried to find reasons to continue but there’s only one. To marry the love of my life and raise proud and happy kids. 


It seems like that’s my only drive in this darkness. Is true lovr really worth eons of pain and agony that I’ve been through and will go through?

Not cure everything but make it worth it",iEmpty,2,5,https://www.reddit.com/r/SuicideWatch/comments/ab36j4/is_finding_love_a_reason_to_continue_living_is/,12/31/2018/03:26:10,ab36j4,SuicideWatch
What's the best way to disfigure your face?,[deleted],,1,4,https://www.reddit.com/r/SuicideWatch/comments/ab35fz/whats_the_best_way_to_disfigure_your_face/,12/31/2018/03:22:29,ab35fz,SuicideWatch
why do i hate myself so much when I can't complete something,I feel like a total failure all the time and I can't find the courage to learn something new. I wanted to crochet but couldn't do it and what I thought would be a fun project to pass the time but I couldn't do it and it ended up making me feel like a stupid failure and want to die. I don't know why I feel so stupid and worthless all the time. I am unemployed and can't imagine ever being happy unless I could start life over somehow. ,pandaappleblossom,2,5,https://www.reddit.com/r/SuicideWatch/comments/ab33n9/why_do_i_hate_myself_so_much_when_i_cant_complete/,12/31/2018/03:16:26,ab33n9,SuicideWatch
Just sick of it,"I’m a college drop out, live with my parents and share a room with my bro. Have good friends but I’m 21 and everyone knows what happens as we get older, ppl go away. I’m socially awkward and have no luck with girls. A lot of my self esteem issues spawns from that which results in really shitty depression 

I’m heavily medicated, ssris the lot. Have a really bad Benzo habit and to be honest I don’t see a future for me. I’m not suicidal right now but the thought of it is coming into my head more and more ",lilmilkyy,1,13,https://www.reddit.com/r/SuicideWatch/comments/ab31es/just_sick_of_it/,12/31/2018/03:08:48,ab31es,SuicideWatch
Pros and cons,I just wrote a pros and cons list to killing myself.... And the pros outweigh the cons..... All the cons are just what could be... While the pros of killing myself would guarantee me freedom from everything.... All the pain that I have been through all the pain I'm going through... I can't find a way out other than suicide.... I'm starting to wonder if keeping myself alive is really worth it anymore.... ,xShadowX145,7,13,https://www.reddit.com/r/SuicideWatch/comments/ab305t/pros_and_cons/,12/31/2018/03:04:31,ab305t,SuicideWatch
I don’t want to live to see 2019.,[deleted],,2,5,https://www.reddit.com/r/SuicideWatch/comments/ab2zu2/i_dont_want_to_live_to_see_2019/,12/31/2018/03:03:25,ab2zu2,SuicideWatch
"Hey there, i'm looking for some help",[deleted],,1,20,https://www.reddit.com/r/SuicideWatch/comments/ab2yxb/hey_there_im_looking_for_some_help/,12/31/2018/03:00:29,ab2yxb,SuicideWatch
100% convinced no one will really care if I’m dead,"“Friends” will get over it in less than a week, my parents will be fine probably, boyfriend will move on 
I seriously don’t see the point when any friends you had left shuts you out 
I just want to go to my garage and turn on both cars and take the rest of my Xanax later. I’ll never have friends or be successful so what’s the p o i n t ",kgreatie,3,10,https://www.reddit.com/r/SuicideWatch/comments/ab2wka/100_convinced_no_one_will_really_care_if_im_dead/,12/31/2018/02:52:16,ab2wka,SuicideWatch
Always thought that when my fathers die i’ll kill myself,"I just don’t connect with people, i try, i really try.
I’m a functional person, have plenty acquaintances, but else than that i am pretty isolated.
I don’t have a vocation, friends, loved ones, desires or goals more than short term goals which is to buy things and Im aware of this because is what i do while my fathers are still alive.
Don’t have will to live after that",elaustero,1,1,https://www.reddit.com/r/SuicideWatch/comments/ab2ugv/always_thought_that_when_my_fathers_die_ill_kill/,12/31/2018/02:45:19,ab2ugv,SuicideWatch
I miss her,"I honestly can't get her out of my head even though we was going rocky it was still the best 5 years of my life. And I can't I feel alone and empty I know this sounds weak but holy shot she was the only thing keeping me sane and its cause of me that we had to break up and I love her and its just so FUCKING hard not talk to her or not visiting and God I would do anything for her. 
If somebody wants to talk, I need to not think about it otherwise ima just....idk
Can somebody be a pen pal because I can't break down and call her she is also going through a lot ",Memecream95,5,7,https://www.reddit.com/r/SuicideWatch/comments/ab2tbw/i_miss_her/,12/31/2018/02:41:43,ab2tbw,SuicideWatch
I can't do this anymore,[deleted],,3,1,https://www.reddit.com/r/SuicideWatch/comments/ab2t4j/i_cant_do_this_anymore/,12/31/2018/02:41:03,ab2t4j,SuicideWatch
Am I ever going to be able to do it?,[deleted],,1,1,https://www.reddit.com/r/SuicideWatch/comments/ab2szn/am_i_ever_going_to_be_able_to_do_it/,12/31/2018/02:40:36,ab2szn,SuicideWatch
I'm just so tired.,[deleted],,2,2,https://www.reddit.com/r/SuicideWatch/comments/ab2se3/im_just_so_tired/,12/31/2018/02:38:34,ab2se3,SuicideWatch
Spider-Gwen,[deleted],,1,1,https://www.reddit.com/r/SuicideWatch/comments/ab2qus/spidergwen/,12/31/2018/02:33:26,ab2qus,SuicideWatch
So ready for an overdose. LIKE I AM READY FOR IT.,[deleted],,2,3,https://www.reddit.com/r/SuicideWatch/comments/ab2n3u/so_ready_for_an_overdose_like_i_am_ready_for_it/,12/31/2018/02:20:42,ab2n3u,SuicideWatch
hopefully i die soon (sorry for this post being all over the place),"I’m female and 14 in 10 days and a few hours, I know how bad that sounds but I’ve been struggling with suicidal thoughts since the age of 11. I’ve so far been diagnosed with severe anxiety and mild depression. 

I lost my father at age 11, in March, and nothing has been the same since. His passing isn’t the main thing that makes me want to die, I’m just constantly sad for no reason and I just feel like such a waste of space. I always cry and I’m such a pathetic child. I’m extremely self conscious and I’ll never think of myself as anything better than a waste of space. I come from a decently large family, and me being the youngest child doesn’t help as I’ve always been just kinda picked on I guess.

I self-harm, very often and it’s always in large amounts. All up both of my arms (from my wrists to my shoulders) are covered with cuts. I try to talk to my best friend about my cuts but he’s so accepting and he doesn’t see anything wrong with it. Personally I think of all my cuts and scars as so beautiful.

I just want to end my life, i know everyone says “Oh, you’re so young! You have so much left to still discover!”. I’m always complimented on my level of maturity and I know I’m very mature for your average Irish teenager. I know I want to end my life, but I’m still unsure on how to do it.

I’m sorry for any spelling mistakes as I’m just really upset and not taking much time to proofread.
",Emilyyy-H,2,14,https://www.reddit.com/r/SuicideWatch/comments/ab2gx2/hopefully_i_die_soon_sorry_for_this_post_being/,12/31/2018/01:59:30,ab2gx2,SuicideWatch
my dad's kicking me out in 40 days.,[deleted],,1,11,https://www.reddit.com/r/SuicideWatch/comments/ab2fe0/my_dads_kicking_me_out_in_40_days/,12/31/2018/01:54:23,ab2fe0,SuicideWatch
someone to chat?,"I suffer from depression since a couple years ago. Im 24. Im alone, i isolated myself in the countryside, and i having strong suicidal thoughts...Im drinking a lot...",jasonkovacs94,2,3,https://www.reddit.com/r/SuicideWatch/comments/ab2c6k/someone_to_chat/,12/31/2018/01:43:46,ab2c6k,SuicideWatch
"Help,",[deleted],,1,2,https://www.reddit.com/r/SuicideWatch/comments/ab2buk/help/,12/31/2018/01:42:42,ab2buk,SuicideWatch
"my self esteem is horrible, I hate myself. Give me compliments or I'm shooting myself",I just wanna die and I feel like nobody appreciates me at all,cedehhdisciple,4,3,https://www.reddit.com/r/SuicideWatch/comments/ab2b33/my_self_esteem_is_horrible_i_hate_myself_give_me/,12/31/2018/01:40:17,ab2b33,SuicideWatch
Hey tb to when I was like 8 and wasnt an empty husk that didnt want to kill myself on the daily,,Diggy84,16,4,https://www.reddit.com/r/SuicideWatch/comments/ab26c1/hey_tb_to_when_i_was_like_8_and_wasnt_an_empty/,12/31/2018/01:24:55,ab26c1,SuicideWatch
Escapism and suicidal thoughts,"Its like when I allow myslef to think, all the dark thoughts come at once, and its too overwhelming. So instead I tend to escapist measures. I dont want to face reality, and when I do, it all comes too much sometimes, and I dont want to live. I honestly dont know what to do. Like Im seeing a therapist, but it feels like Im only going in circles",gr10t,3,2,https://www.reddit.com/r/SuicideWatch/comments/ab1zvz/escapism_and_suicidal_thoughts/,12/31/2018/01:04:44,ab1zvz,SuicideWatch
I've taken so many steps forward. I feel like I'm there. But I still want to die.,[deleted],,2,0,https://www.reddit.com/r/SuicideWatch/comments/ab1yqh/ive_taken_so_many_steps_forward_i_feel_like_im/,12/31/2018/01:01:18,ab1yqh,SuicideWatch
Weed was helping but now I'm scared that it's giving me psychosis or something,[deleted],,3,7,https://www.reddit.com/r/SuicideWatch/comments/ab1yd9/weed_was_helping_but_now_im_scared_that_its/,12/31/2018/01:00:07,ab1yd9,SuicideWatch
I'll die lonely then,[deleted],,4,3,https://www.reddit.com/r/SuicideWatch/comments/ab1wj5/ill_die_lonely_then/,12/31/2018/00:54:05,ab1wj5,SuicideWatch
suicide pact forum?,[removed],softservecon,1,0,https://www.reddit.com/r/SuicideWatch/comments/ab1wgp/suicide_pact_forum/,12/31/2018/00:53:51,ab1wgp,SuicideWatch
Done.,[deleted],,1,1,https://www.reddit.com/r/SuicideWatch/comments/ab1ui2/done/,12/31/2018/00:47:39,ab1ui2,SuicideWatch
2019,[deleted],,1,1,https://www.reddit.com/r/SuicideWatch/comments/ab1ugi/2019/,12/31/2018/00:47:34,ab1ugi,SuicideWatch
I was doing good,"I told myself I would hang on til the 28 to see my brother for the first time in a long time ( and it was his 18th birthday). I saw my mom and “aunts” (my moms best friends who lived with us for years) too. I did it I made it. But the thoughts had only gotten stronger as it got closer. Well I did it and now here I am debating if today’s the day. I almost reached out to a hotline because I don’t want to die without telling someone I’m sorry out loud.  but every time I’ve done it they say, “No one forced you to reach out so you don’t really want to die” oh I do. I’ve tried help,Tried a respite house, I’m waiting for group therapy (February), hospital here sends me home.. I don’t deserve help. Im a burden if I try anymore. So I’m sitting here.. I messed up already. (Self harmed) and other stuff but now I just said to decide if tonight’s the night... ",alittleconfusedspoon,1,1,https://www.reddit.com/r/SuicideWatch/comments/ab1u0z/i_was_doing_good/,12/31/2018/00:46:12,ab1u0z,SuicideWatch
Got no future,"In a few months I'm gonna have to sit some exams that will determine how well I'm gonna do at life. I already know I'm gonna fail most of them anyway and there's just too much pressure to do well. I've been seriously considering suicide for a few months now. Everyday it gets worse and worse, I can't take it for much longer.

Why shouldn't I kill myself now instead of making myself suffer for longer? 

And please don't come up with all the ""contact your suicide hotline"" bullshit there s no point they  can't do anything.",Odise98,1,5,https://www.reddit.com/r/SuicideWatch/comments/ab1skp/got_no_future/,12/31/2018/00:41:43,ab1skp,SuicideWatch
"After what would seem like an eternity of struggle, I am finally ready.","I believe that I have done my part by now. I am ready to go. The edge is within my grasp and I know how it all ends. Thank you for giving me the opportunity and pleasure of helping any of you that I have. When the moment is right, I will let go. I have fought long enough.",TheSacredRing,3,11,https://www.reddit.com/r/SuicideWatch/comments/ab1ryd/after_what_would_seem_like_an_eternity_of/,12/31/2018/00:39:48,ab1ryd,SuicideWatch
