title,text,author,score,num_comments,url,timestamp,subreddit_id,subreddit
I almost killed myself at a behavioral health clinic.,"This happened about a half an hour ago, and I’m still shaking.

I had just finished my second therapy appointment. It went somewhat well. I was nervous, and jumpy.

At the end of the appointment my therapist gave me my paper. My eyes drifted to the problem list.


Bipolar disorder 2, knew that. Panic disorder with agoraphobia and moderate panic attacks. Knew that. Attention deficit hyperactivity disorder. Yup. Substance use disorder. I dispute that, but I see why they would think so. And then...

Borderline personality disorder. That was new.

I started to spiral. Crying. I asked the therapist as she walked me out if it was true. She said it was just words on paper, that we would talk about it at the next appointment. But I was already drowning.

She told me there was a bathroom in the hallway. She told me to go practice my breathing exercises.

I went to the bathroom, but I did not do breathing exercises.

I cried. Hard. For 20 minutes straight. I googled borderline, and came to the conclusion that I could never find love and I would eventually hurt and chase off everyone who loves me.

Then someone came into the bathroom and I shut up.

I needed somewhere more private. And frankly, I had quite the pick.

The clinic is on the second floor of a mostly empty building. There are plenty of grey unpainted rooms that you can simply wander into.

But I ended up picking the stairwell. No one used the stairs.

You see where this is going.

I sat on the second floor landing. I cried for awhile. Then I saw something strange.

Bird shit.

Did this place lead to the roof?

Curious, I climbed the stairs. Up and up and up, 7 stories. I reached the door that lead to the roof. I tried to push it open. Locked.

Too bad. I would have liked to see the view of the city.

I leaned on the safety rail and looked down. I was so high up, and the concrete floor was right below. Beckoning.

I stood on the lowest rung of the safety rail. Staring. Jump. Jump. Jump.

My legs started shaking. My breathing sped up. A tear rolled down my face and fell. I had to decide if I would follow it.

I stepped away. My thoughts were crazy. I felt invigorated. My heart was thumping it was a rush.

Now I’m sipping a mimosa over a veggie burger (first time I had one), with sweet potato fries and butternut squash soup.

I don’t know if I regret not jumping yet.",waytoomanyfandoms,3,3,https://www.reddit.com/r/SuicideWatch/comments/aaehgo/i_almost_killed_myself_at_a_behavioral_health/,12/28/2018/21:20:55,aaehgo,SuicideWatch
Please message for advice,[removed],LordBakedPotato,1,0,https://www.reddit.com/r/SuicideWatch/comments/aaec5z/please_message_for_advice/,12/28/2018/21:04:53,aaec5z,SuicideWatch
Suicide journal,[deleted],,1,1,https://www.reddit.com/r/SuicideWatch/comments/aaeab2/suicide_journal/,12/28/2018/20:59:39,aaeab2,SuicideWatch
I don’t want to be alive anymore,[deleted],,6,2,https://www.reddit.com/r/SuicideWatch/comments/aae8wn/i_dont_want_to_be_alive_anymore/,12/28/2018/20:55:30,aae8wn,SuicideWatch
heck,Whats up with everybody trying to stop suicidal people? It's already miserable as it is just say it's ok to die and let them. I just need someone to give me confirmation that it is ok. There is literally nothing to look forward to. It looks like everyone in our society are dicks and I don't want to be part of this dick fighting drama.,,3,1,https://www.reddit.com/r/SuicideWatch/comments/aae88v/heck/,12/28/2018/20:53:27,aae88v,SuicideWatch
2019 is the last year I'm gonna be putting effort in order to try turn my life around and if I fail again I'm ending it December 25th 2019,"Sick and tired of how shit everything in my life is, I've tried and tried again but it always get worse. Next year is the last fucking time and if I fail *again* I'm fucking offing myself.

I have nothing to look forward to or be happy about and haven't done for years.

My life has no purpose and all I think about is death and how the world would be a better place without me and how I'd finally be at peace without the bullshit society throws at me.


Here's what I plan to do In order to get better:

• Get a job (god knows what because nothing interests me)

•Make friends 

•Get into a meaningful relationship (never had one so doubt this will come true as girls have zero interest in me)

•Get a routine 

•Make at least one person smile

•Travel to another country 

•Make something of myself 

If all fails I'm gone, I hope 2019 is my year, I don't want to die but it's my only way to escape from this hell hole.",throwaway-085346,61,29,https://www.reddit.com/r/SuicideWatch/comments/aae74o/2019_is_the_last_year_im_gonna_be_putting_effort/,12/28/2018/20:49:57,aae74o,SuicideWatch
This is all pointless,Lets say im succesfull in life ill die anyway and if its the other way around ill still die. Whats the fucking point? ,oksidasyon,8,2,https://www.reddit.com/r/SuicideWatch/comments/aae5tk/this_is_all_pointless/,12/28/2018/20:46:07,aae5tk,SuicideWatch
You should hold off,[removed],,1,4,https://www.reddit.com/r/SuicideWatch/comments/aae4ye/you_should_hold_off/,12/28/2018/20:43:37,aae4ye,SuicideWatch
How the fuck,[deleted],,1,2,https://www.reddit.com/r/SuicideWatch/comments/aae00n/how_the_fuck/,12/28/2018/20:29:05,aae00n,SuicideWatch
I ruined my friendship with my bestfriend,"I just fucked too many times
We still talk but it kills me to feel him colder from conversation to conversation 
I dont blame him
Just wish i wasnt this stupid",iamtooafraidoflife,2,2,https://www.reddit.com/r/SuicideWatch/comments/aadzi3/i_ruined_my_friendship_with_my_bestfriend/,12/28/2018/20:27:28,aadzi3,SuicideWatch
Had a dream....,[deleted],,2,6,https://www.reddit.com/r/SuicideWatch/comments/aadxoj/had_a_dream/,12/28/2018/20:22:14,aadxoj,SuicideWatch
Tired,"Im not unmotivated. I regularly go to the gym, im attractive (or so i've been told), im pursuing my career in art and my skills are pretty decent, i have friends who care about me even if i have a family that doesn't.

In fact this year has been even better than any other in terms of overcoming my social anxiety and intimacy issues.

However I am overly self aware and Im constantly trapped in my own head. I lack a close enough connection with anyone in my life to tell them about my depressive episodes and suicidal tendencies.
The last person i was that close to was my ex, and while i have gotten over her ive realised that even if i get that close to someone again, their presence is not permanent.

I cant rely on anyone else
I cant rely on myself

Recently ive been looking at places in my area that would be strong enough to hold a noose and my body. I cant do it in my house since i'd likely be stopped.

Im tired....
",panicthesmoker,2,1,https://www.reddit.com/r/SuicideWatch/comments/aadxh0/tired/,12/28/2018/20:21:33,aadxh0,SuicideWatch
For everyone out here because we’re one family. Here’s a good reading that could help many of you as it helped me.,[removed],bcapric,19,2,https://www.reddit.com/r/SuicideWatch/comments/aadwvk/for_everyone_out_here_because_were_one_family/,12/28/2018/20:19:46,aadwvk,SuicideWatch
Almost hurt myself twice last night,[deleted],,4,1,https://www.reddit.com/r/SuicideWatch/comments/aadv4o/almost_hurt_myself_twice_last_night/,12/28/2018/20:14:47,aadv4o,SuicideWatch
"Chridtmas is over, 2019 is close...","On christmas i went out with some old classmates... I mixed few drinks and then we went to smoke weed. I then felt dizzy af, stayed outside alone for 5 mins and started throwing up like theres no tomorrow. Everyone was like ""oh my god hes fucking dying"". My body was shaking and i felt cold, very cold. After like 5 hours i stopped throwing up and then got home and slept. I honestly wish i would have died that day somehow... I wish something would have went wrong and i just died.......... ",IcecreamMostlyIMH,1,1,https://www.reddit.com/r/SuicideWatch/comments/aadq1n/chridtmas_is_over_2019_is_close/,12/28/2018/19:59:53,aadq1n,SuicideWatch
well shit,"seems like attempt 3 didnt work either. all my pills are gone, i didnt take them. i'm scared that my brother took them but icant ask him about that

i really dont know what to do, i told a friend of mine and he gave me advice on how my next (and hopefully last) attempt should be planned out. 15th of may 2019 will hopefully be the day lol

i'm such a damn pussy, i attempt but never push thru.",cocainedanceparty,1,3,https://www.reddit.com/r/SuicideWatch/comments/aadl90/well_shit/,12/28/2018/19:45:45,aadl90,SuicideWatch
Planning a Suicide calms me.,"Every time I get stressed and have an anxiety epsiode, my mind subconsciously plans a method to kill myself. 
And before I know it, 30 mins will be passed and I will be calm as a clam. I haven't gathered courage to attempt again but I sure have thought of every possible way and calculated the risks, amount of time it takes, availablity of such materials assisting suicide, effective time to attempt, etc etc. 

Everyday I drown a little more into the depth, I can't stop drowning, everytime I think this is little better, I drown 100 times more, it's like I can't even be at peace for 2 days then it hits me again. I am afraid of being 'happy' because I know the good deal of it is waiting for me. 
I can't talk to my friends, even though I made some through online, I can't openly talk to them or cry to them because i don't want them to drown with me in my depression. 

Hopefully I can somehow gain courage to atleast attempt a little one, may not be deadly but gotta start somewhere again. That's all I can be 'hopeful' for. 

Thank you for reading.",PurrplePixie,173,46,https://www.reddit.com/r/SuicideWatch/comments/aadjpm/planning_a_suicide_calms_me/,12/28/2018/19:41:17,aadjpm,SuicideWatch
How to help my suicidal ex when it seems like he wants to get back together?,"I randomly checked my instagram a couple of days ago and noticed that my ex had uploaded pictures and captions with a strong theme of depression, suicide, and uncertainty towards the world and himself. I checked his feed and he hasn't posted anything for a year before uploading 3 pictures back to back in a span of minutes. 

My ex and I had a not-so-smooth end in our relationship about 2 years ago where he ghosted me and I felt disposable but felt like I had no other choice but to let it go, which results in a strange resentful and bittersweet feeling when I have thoughts of him. 

At this time, I haven't been in communication with him for a year and we are civil with each other but this worried me and seemed like a cry for help, so I asked him if he was okay. (At this point of my story it's going to be a back and forth to recap our messages.) At first he said he was fine but then asked me why I messaged him. I told him that I had good intentions and asked again if he was okay. He said that he has been on a downward spiral with depression. I tried to reassure him and asked how long this has been. He says that he doesn't want to talk about it at risk of receiving pity. I tell him that I don't feel pity but I am worried about him. He opens up and says that in a way he misses me but he doesn't want to invest emotions. I ask him what he meant by that and his answer turns vague so I ask for clarification but he doesn't get back to me.

Knowing that he posted this at Christmas, my concern just grew more since I worry he's isolated and his feelings of depression being exaggerated due to the holidays. I decided to leave the conversation for the time being and went to sleep with some of those feelings of hurt coming back again since it seems like I'm getting ghosted again, but I know not to take it personally.

The next evening comes and I feel like I have to convey a message that I am here and present and don't want him to make stupid decisions based on depression. My main concern is that I don't want him to feel isolated because as someone who's experienced depression during the holidays before, it can be very tough. 

Now here's the part where he opens up (He has a tendency to bottle things that I've observed in the past so I can imagine this is rough on him). He tells me he wants more than my presence and hates that I'm dating my boyfriend now. (I met my boyfriend through him but we saw each other again on an app after half a year of when my exbf ghosted me.) He proceeds to open up and says that he feels that I was the best he ever had and he fucked up our relationship and feels that this is karma for his faults. He proceeds to self-deprecate and says it will be better to off himself in the future. And then he tells me that his cat, who I knew he was very close with, has passed so he doesn't have an animal companion. These messages sent me on an emotiomal rollercoaster but I tried my best to collect myself to compose a message of reassurance, me telling him that it hurts me to see him in this pain, and I asked him if there was anyone he has in contact for comfort. I fear that I went around his first messages of saying he misses me because I know I can't provide him any romantic offerings as I am in a happy and committed relationship.

He has read my message and hasn't replied to me since then. In hindsight, maybe I should've made the conversation lighter and not too focused on his depression to make it seem like he's just a ""normal person"". I'm wondering if I should ask him to go for tea with me and talk so his fear that people would pity him would dissolve since it's a message that doesn't seem to focused on his depression?  I'm really not sure how to proceed with this and I'm very worried about his well-being. I don't think he'll respond to the idea of a medical professional well but I feel like I can slowly bring it up if we do have a conversation IRL where he can't ghost me.


TLDR: Ex is suffering through depression and has suicidal thoughts but has implied that he misses us. How do I offer reassurance properly?",mwtkthro8888,1,1,https://www.reddit.com/r/SuicideWatch/comments/aadhq0/how_to_help_my_suicidal_ex_when_it_seems_like_he/,12/28/2018/19:35:35,aadhq0,SuicideWatch
soon,"i'm going to wake up from this nightmare.

&#x200B;

how, why, or when? i'm not sure...

&#x200B;

all i know is that it'll happen.

&#x200B;

and soon.",ferbderb,9,3,https://www.reddit.com/r/SuicideWatch/comments/aadgo6/soon/,12/28/2018/19:32:37,aadgo6,SuicideWatch
Someone Just Ask,"I dont make it clear what im feeling i mostly go along and pretend to be alright so i dont expect anyone to ask me if im okay. but holy shit i cant do it anymore. im not gonna amount to anything in life. im a low life piece of shit who hates being around people. I cant hang out with big groups, and when i do my energy levels depleat so fast. i am in love with someone who so clearly doesnt love me, which happens to be one of my only friends. I feel like me being gone is better jn the long run. i drag everyone down, im not funny, im not smart, i have no interests. im a literal waste of a life. i just hit puberty at 16, im 17 almost 18. I just graduated, i have no plan. I want to tell this to someone but they think im joking or im doing it for attention. when attention is the last thing i want. some days i feel dead i feel like everything is a struggle from getting out of bed to going to work. even having a simple conversation. i know the ""symptoms"" of depression and i dont have jt i dont think. idk i feel like some days i can conquer the world and others everyone is talking shit about me and everyone hates me. i feel like im a weight on everyone and even though some would be sad i think it would truly help some progress their lives. including myparents not having to worry about me. i just want someone to fucking ask me if im doing okay someone that wont fucking judge me or think its for attention. i know im going to kill myself soon i just need the day where i build up enough courage. if anyone is still reading this thank you, im not looking for your sympothy im just sitting in my car typing what ever comes to mind. thank yiu",dln6,1,2,https://www.reddit.com/r/SuicideWatch/comments/aadeo1/someone_just_ask/,12/28/2018/19:26:54,aadeo1,SuicideWatch
Big decision to make,"32/M/loser. Push shopping trolleys for a living. Live with mother and her boyfriend. Depressed af and constantly miserable. No ambition or motivation.

Recently, I went to Japan and met a girl. I lied to her and told her I had a better job, could drive, lived alone etc because no one dates me in my loser state. She completely loves this fake version of me. It's a lot of fun and I'm happy when I'm with her.

Back home I am miserable. I spend all my time when I'm not working sat alone in my bedroom.

Today, I told my mother that I'm handing in my notice at work on Monday and going back to Japan. I have  about 5-6 thousand pounds left of my grandfather's inheritance. I will probably last 3-4 weeks there. When I return I will be jobless and homeless.

If I stay here as is, I won't leave my job. I'll probably die doing this. Either choice could result in my suicide, before my grandfather died, I was already about to attempt suicide.

I don't know which choice to make. I don't have long to decide.",fbjyfkn,1,23,https://www.reddit.com/r/SuicideWatch/comments/aadab4/big_decision_to_make/,12/28/2018/19:13:41,aadab4,SuicideWatch
"At the end, but stuck.","I have been having intrusive thoughts for about 20 months. I want to kill myself. The only thing putting me off was the fact I’m breastfeeding my daughter and she couldn’t survive without me. Now she is nearly 2. She still feeds but she can survive without me, so can my 6 year old.

I want to end it. I bring nothing to my family. I don’t work right now. I went from school to college to uni, then had my youngest. I’ve only worked at one place whilst I was in college. I’m nervous to work again even though I have a degree now. 

My partner brings in money. I contribute nothing financially. I feel so low I can not motivate myself to have the house sparkling clean every day. 

I am fat.
I am ugly. 
I am worthless. 
I am a failure, of a partner and a mother. 

My issue?? Whenever I think of commiting suixide I can’t decide how... step in front of a vehicle or off a bridge onto the motorway could ruin someone else’s life.... tablets will just leave me in pain for days then I’ll get better... I have no access to firearms... sleeping tablets aren’t strong enough...

And the other issue? If I think of something all I think of is my kids growing up without me... like I want to die but I don’t want to emotionally or mentally scar them... would it be better to run away then do it so they just think I ran away, not died? 

Sorry for the essay 😭😭😭😭",TheowAway365,3,3,https://www.reddit.com/r/SuicideWatch/comments/aad24q/at_the_end_but_stuck/,12/28/2018/18:49:27,aad24q,SuicideWatch
A dog's life,"I wouldn't have made it this long without my dog. Last thing on this earth that truly cares about me. As long as he is around, I will be too. People can be told, but he wouldn't understand how I could leave him, so I won't. 

But someday, he will. Dogs don't live as long as people, and mine has already made it past the long side of breed average lifespan. When he does, my last reason to be here goes with him, and I'll follow shortly after. 

I have the spot, I have the rope, I've tied the knots enough to do it with my eyes closed, or full of tears. One small step, one long drop, one last goodbye. Someday soon. 

The only good thing about the waiting, is that it gets easier. I've spent so long hiding the pain it has become automatic. I'll be heading to antoher funeral later, a good spot to be suicidal. There are so many sad faces around I won't worry about being seen. 

Please don't ask questions, this isn't a call for help. Don't tell me about people who care, or others who feel sad, we all know this place sucks. ",TearsLikeRain,2,2,https://www.reddit.com/r/SuicideWatch/comments/aad23e/a_dogs_life/,12/28/2018/18:49:20,aad23e,SuicideWatch
I’m done with life.,[deleted],,16,6,https://www.reddit.com/r/SuicideWatch/comments/aad03s/im_done_with_life/,12/28/2018/18:43:45,aad03s,SuicideWatch
Does anyone else not give a fuck about their health just so there's a higher chance of dying?,"I live a pretty unhealthy lifestyle but I don't really give a fuck cause at least that means I'm shortening my lifespan. I haven't excercised in over a year and I frequently go days without eating. I know this might not be the best way of thinking since poor health will make my life more miserable up until the point where I actually die, but tbh, I'm just too exhausted to care anymore. Is this just me or does anyone else feel this way?   ",Ghettosaurusrex,123,47,https://www.reddit.com/r/SuicideWatch/comments/aacxau/does_anyone_else_not_give_a_fuck_about_their/,12/28/2018/18:35:35,aacxau,SuicideWatch
I said I would kill myself on my birthday last year,"The last big fight I got into with my dad was March 29th 2018. I said if shit didn’t get better I’d kill myself on my next birthday.
9 months later I still walk on eggshells at home, I still get treated like the white trash I am at work, and I still ain’t really “close” with anybody. I could disappear tomorrow and it would take days for anybody to realize it. 

Don’t know what I’m still doing here. Literally my only will to continue to live and struggle and work is the thought of one day being able to live in the woods and not have to deal with this shit world anymore, and the very slight, nearly nonexistent possibility that one day a girl is able to see past my poor genetics and weirdness and love me. I’ve pretty much given up on that. Some people say I’m attractive, but I know they are lying because pretty much any woman I ever interact with is just shitty with me yeno. Like they aren’t mean unless we’re talking the managers at work but the pleasantness is just forced. It fucking crushes me every day to walk into the gas station and the face the lady makes when she knows she has to serve me. This world is pure and utter fucking shit and anybody that tells you otherwise doesn’t know what it’s like to be at the bottom.

Whether or not I end myself in March is unknown. I’ve been saying it and wanting to do it since when my brother started to get bad. I just felt like sharing and not writing it all down in my notebook because nobody cares enough to listen to me. If you made it this far I hope your having a great day and if your not at least treat yourself to one little thing, even if it’s small. :)",redneck_ancap,1,2,https://www.reddit.com/r/SuicideWatch/comments/aacvlt/i_said_i_would_kill_myself_on_my_birthday_last/,12/28/2018/18:30:25,aacvlt,SuicideWatch
First desperate suicidal wish,[removed],,1,0,https://www.reddit.com/r/SuicideWatch/comments/aacvgx/first_desperate_suicidal_wish/,12/28/2018/18:30:00,aacvgx,SuicideWatch
Again and again,[deleted],,1,4,https://www.reddit.com/r/SuicideWatch/comments/aacs0l/again_and_again/,12/28/2018/18:19:41,aacs0l,SuicideWatch
"I'm a Parasite, and New Years Eve I'm Gonna Destroy the Parasite","I've done nothing my entire life but take from my parents. I'm 20 and I've never thought about where I am and what I want to do in life. I was so absorbed by video games and youtube that I refused to work hard or study at all anywhere.  
I've been in community college for 2.5 years now and for the first two I had no idea what I was doing. I started believing that life has no purpose and it eats at me a lot, but I still could've looked for something to work on. 

Anyways, this semester was my final hour, my saving grace, my one chance to redeem myself. I would work hard, forgo games and videos, and become something. I didn't stop watching youtube though, and I relapsed on the games halfway through the semester. I ended up with two C's and a B, and that B was in a class that any monkey could've made an A in. Literally one grade decided I made a B and it was because I was lazy about it and think about it until the night before. I thought I was in the clear after that, it would be harder to get into the program I want, but I would get a chance to still retain some sort of self-respect. I wouldn't have been hurt if I simply hadn't been accepted. However, I looked last night and I need a minimum GPA of 2.8 to get in, and mine's 2.76.

Now, you may say, ""2.76? That's not that bad, you can just take one class, make an A in it and get in, no problem!"" I don't think I can stay here for another year though, continually being reminded that I am a disappointment, that my parents would be happier just dealing with their one successful kid. If I cared about myself I would deal with it, but honestly, I can't care anymore. I'm not depressed, I'm lazy, I only want to play and philosophize. I also don't want to be 30 and living with my parents either, that's not fair to them. None of this is. If I were an honest person, I would've told them from the start of the semester that I was watching youtube, that I was playing games, but I'm in college and it's my responsibility. 

I'm thinking New Years Eve, while everyone is shooting off fireworks, is the time to do it. Thank you for your time.",Cedar302,3,4,https://www.reddit.com/r/SuicideWatch/comments/aacml7/im_a_parasite_and_new_years_eve_im_gonna_destroy/,12/28/2018/18:04:01,aacml7,SuicideWatch
I'm scared my OCD is back again and won't go away,[deleted],,2,0,https://www.reddit.com/r/SuicideWatch/comments/aack78/im_scared_my_ocd_is_back_again_and_wont_go_away/,12/28/2018/17:57:17,aack78,SuicideWatch
