title,text,author,score,num_comments,url,timestamp,subreddit_id,subreddit
Concerned about a brother’s classmate. Is there anything I can do?,"So earlier today, my (20F) brother (12M) told me that his friend (same age) is suicidal. He told me that she self harms and has rope marks on her neck. When I asked him what his reaction is, he said that whenever she feels like she wants to or is going to kill herself, my brother talks to her and that he’s the only person who can talk her out of it. I don’t know her name, just age.

It’s crazy that this is happening at 12, but I stayed calmed in front of my brother. But I’m freaked out. I feel like I should have asked him more questions or said something, but I didn’t know what and the conversation moved on.

Which brought me here. I want to help or at least give my brother some advice, but don’t know what. Our mum has strong negative opinions on suicide, so tell her would do nothing. Same with the high school (I finished there last year). A kid tried to commit suicide last year and a teacher just yelled at them. I don’t think the school is fit to help them. What should I do and how do I press the issue again with my brother?",Squishy_Pixelz,4,2,https://www.reddit.com/r/SuicideWatch/comments/aaqh0e/concerned_about_a_brothers_classmate_is_there/,12/29/2018/23:50:02,aaqh0e,SuicideWatch
dxxth,"I want to kill myself. and no, there's nothing for me to live for. I've been very optimistic up until I couldn't be anymore. there is nothing keeping me here nor could there be. I'm tired. ",gxmergxrl,1,0,https://www.reddit.com/r/SuicideWatch/comments/aaqg3q/dxxth/,12/29/2018/23:47:09,aaqg3q,SuicideWatch
Why do people lie.,[deleted],,4,3,https://www.reddit.com/r/SuicideWatch/comments/aaqg2x/why_do_people_lie/,12/29/2018/23:47:04,aaqg2x,SuicideWatch
Will someone kill me so I don’t have to do it? I won’t even charge ya :),[deleted],,1,3,https://www.reddit.com/r/SuicideWatch/comments/aaqdmk/will_someone_kill_me_so_i_dont_have_to_do_it_i/,12/29/2018/23:39:05,aaqdmk,SuicideWatch
Trying my best not to end it all tonight,[deleted],,11,5,https://www.reddit.com/r/SuicideWatch/comments/aaqbku/trying_my_best_not_to_end_it_all_tonight/,12/29/2018/23:32:27,aaqbku,SuicideWatch
Not going to see the new year,Heard from no friends at Christmas. Got no gifts. Family is ungrateful. No reason to keep up the charade of a happy life. Car is hooked up to hose. New Year's Eve about 6 p.m. will be it. F this life.,RuralPARules,1,4,https://www.reddit.com/r/SuicideWatch/comments/aaq8v3/not_going_to_see_the_new_year/,12/29/2018/23:23:46,aaq8v3,SuicideWatch
Why I want to die,"Although I am not planning on doing it today, I know that I am most likely to die from suicide.
I am a 20-year US Special Operations Veteran.  I also spent almost 10 years working on private military contracts in the Middle East.  So, what did all that service to my country get me?  PTSD, anger, and soul-crushing depression.  I am so tired of dealing with it.  The pain never goes away.  I have been to therapist.  I have done Cognitive Behavior Therapy.  I have taken different anti-depressants: Zoloft, Paxil, Venaflaxin, and now Wellbutin.  They work for a short time and then the depression monster builds back up and creeps into your mind to remind you as to what a piece of human garbage you are.  It tells you that this is it.  Life is never going to get any better.  It is hopeless.
I have spoken to both civilian as well as veteran suicide hotlines.  The civilian ones follow a script that doesn’t help except to tell you to seek professional help. (Gee, thanks Ann Landers). The veteran hotline was not any better.  There the guy on the other end was basically, “Suck it up”.  So, that wasn’t very helpful.
The Veteran’s Administration is trying to help but they also seem try to fit you into a box.  Not as a criticism, but I am not so sure how well their programs work.  From my own personal experience, not too well.  If 20 veterans are committing suicide every day, then I would have to question their program.
I also have to question the support they receive from this current administration.  Much as Trump talks about loving the military, his actions speak much louder.  He doesn’t like soldiers who get captures so I imagine he is not crazy about those that get wounded or killed either.  Personally, I think he is a physical coward and a bully so I would expect nothing of substance from him.  His one and only visit to a war zone (I think in the middle of the night and for about three hours) he used as a campaign rally.  Not what I would expect to hear from a leader.
The doctors tell me to trust them, it will get better. It hasn’t.  They want to take away the one and ony medicine that has actually helped me when I needed it, a benzodiazepine.  
I don’t believe in God so please don’t tell me to pray.  If you had seen some of the horrible suffering I have witnessed first-hand, to innocent people who are not combatants, you would not believe either.  Because, why would a loving and just God, allow innocent people, I am talking babies and toddlers, to be maimed or their parents killed and they are left on their own, to suffer those horrors?  I was raised Catholic but I left religion a long time ago.  None of it makes sense anyway.
I see terrible people do terrible things and prosper while I see good men and women suffer.  Life is not fair.  I know.  But really, why do we award assholes?
So, while my mind is sinking deeper and deeper into despair, I have to wonder what is all of this therapy trying to accomplish?  All of my problems and personal failures that have accumulated throughout my lifetime are always going to be there.  People say, “Don’t look back, only forward”.  Nice thought but it doesn’t help me with my problems.  We are who we are based on our past.  Often those mistakes and failures continue to impact us as long as we live. 
Finally, regardless of what anyone says, mental illness carries a huge stigma.  And this is why we, the ones suffering with mental illness, don’t talk about it.  If you bring it up, people never look at you the same.  You are looked at as weak.  In the military, if you ask for help, you might as well kiss any promotions away because they will look at you as unfit for duty.  A physical wound is treated with respect.  A psychological wound it looked down upon.  You are taught for years to push through the pain, complete the mission not matter what, your mind will overcome any obstacles.  Well, it is your mind that is now wounded.  You, as the sufferer, feel shame with yourself and that you are weak.  That is the whole culture.  Oh, they may talk a good game but the reality is much, much different.  You are cast as a loser.
In the civilian world, if you say you want to kill yourself, then they can throw you into a hospital for 72 hours.  And now you have a record.  That is sure to help in any background investigation for a job!  
There is no winning.  None.  So, why not kill myself.  I am much closer to the end of my life, age-wise, than the beginning.  I am going to die anyway.  Why not just let me do it.  In fact, I wish they would help us accomplish it with the minimum of pain and suffering. For God’s sake, they worry about causing murderers pain when executing them.  We mentally ill patients, they want to keep us alive as we continue to suffer with our demons.  I can only think it is to make them feel better about themselves at our expense.
I am not having a good life.  I suffer every waking moment.  I just want the pain to end.
Either truly help us or help us die peacefully and painlessly.  
",suicideavenger,29,8,https://www.reddit.com/r/SuicideWatch/comments/aaq6qm/why_i_want_to_die/,12/29/2018/23:17:20,aaq6qm,SuicideWatch
26 and trying to turn things around,"I want to start by saying I love you all very much. I wanted to thank you for taking time to read this. I read long and short posts on this form often and really appreciate people who are suffering from depression or suicidal feelings to open up and talk to other people going through the same. Your experiences and struggle mean so much to me. Your strength and ability to get feedback on how to cope is very inspiring to me. It always has been. This post is somewhat typed fast though I feels like it's a good place for me to start.

A little about my past.  I struggled with depression and emotional/learning disabilities in my youth. I have been diagnosed with a learning disability which effects me in a profoundly negative way along with bipolar. Looking back at my early life I was very troubled. I remember getting into random fits of crying and generally struggling in school despite being a very creative and talented person. By middle school I was attending a special education school. I disliked it and wanted to start a “normal life” 

Starting high school was very thrilling for me. It was the first time I was going to get to meet friends and be integrated in the community. I was a bit of an outcast but I was always nice to people and was somewhat popular. People were attracted to my charisma and creativity. Despite struggling with grades because of my learning disability I was immersed in the arts. I was convinced that though I struggled with grades in the “future” I would be a success in the film production industry because of my hardworking demeanor. Perhaps it was during this time I made some mistakes. I started smoking pot during this time and would skateboard a lot. In retrospect this was a waste of my time. These were some of the best years of my life though at the time I could not see it.Then, during the recession of the late 2000’s my family had to move. We relocated to Virginia. It was very hard for me as a senior and I became very depressed. I was rejected from all of the colleges I applied to and began attending community college after high school. It was during this time I made a huge mistake that will haunt me for life of expressing that I was suicidal to friends and loved ones. My friends at first were supportive though in time became turned off my negative thoughts and feelings. In retrospect I was an asshole to think it was ok to drag people into the darkness in my life and expect them to magically get me out. I guess I was thinking who else do I have to turn to? This was a major mistake because I lost all of my friends as they stopped talking to me and to this day have moved on while I feel I haven’t. 

During college I tried to reinvent myself. Once again, I was outgoing, nice and friendly. I met a lot of people and had a fling or two with someone else. Though, deep down inside I felt as if I was out of place. Attending college in a new state was challenging and towards this time I started to look into moving back to my hometown. 

Post college was a strange time for me. I realize now that I might have had a mental break down and started using social media in an extremely unhealthy way. Posting too much and sometimes getting very personal but more importantly looking at people I knew in high school and becoming incredibly jealous at their life, jobs and relationships. In retrospect I had so much of a support base even then and failed to take advantage of it. I got a job in my career and moved back to VA but I felt alone in that state and desired to come back to the NYC area. Fast forward to now. I moved back in to my Mother’s house 3 years after college. 

Things are at an all time low in my life. I cannot find a job in my career which is causing me to become intensely depressed. I have developed a bad habit of staying in my room or in bed most of the time after work. I work at a warehouse and feel as though I’m slipping future away from my career. I also don’t date and have no friends. I have become quite skinny since college as a result of my hermit lifestyle. Despite this I keep my head up. I keep telling myself that the worst has happened and that good things can come if I work for it. I tell myself that I’ve thought about suicide so much that it’s a very real possibility and I would be better off riding it out and reinventing myself. I want to go to the gym this year and rebuild myself, meet new friends, move out and find a job in my career. Though, it feels like I’m stuck in a rut of job rejections I can’t get out of which makes me feel awful. I have a lot of love in me and don’t want to let go yet. I know I’ve made mistakes in my life time but I know I’m working hard to getting my feet back on the ground so I can live a halfway decent life. I am currently getting back into my career of filmmaking and working on a screenplay that tries to capture so my thoughts on struggles in my youth along with depression and suicidal thoughts. It has been a way to cope with being a loner and living at home as an adult. Though I see some of the steps I need to take to change things around and find some peace with my life. 
",woodstock666,8,7,https://www.reddit.com/r/SuicideWatch/comments/aaq6ek/26_and_trying_to_turn_things_around/,12/29/2018/23:16:17,aaq6ek,SuicideWatch
Had my gun in my hand loaded and decided not to do it,[deleted],,57,17,https://www.reddit.com/r/SuicideWatch/comments/aaq49j/had_my_gun_in_my_hand_loaded_and_decided_not_to/,12/29/2018/23:09:28,aaq49j,SuicideWatch
I have so much love and hope for everyone in my life and I don't want my death to hurt anyone,[deleted],,1,0,https://www.reddit.com/r/SuicideWatch/comments/aaq1c0/i_have_so_much_love_and_hope_for_everyone_in_my/,12/29/2018/23:00:31,aaq1c0,SuicideWatch
Do people react more to losing someone by suicide?,"People grieve those who die. I guess when people kill themselves, others react with anger and confusion along with sadness. And there isn’t really a period of terminal illness, so people can’t prepare. But death is death. Wouldn’t a parent react in roughly the same way if their child died in a car accident? I think so, except for the whole “we could have done something to stop it” thing. It’s weird to me how people view death by suicide so differently. ",eveneveronlyeither,7,5,https://www.reddit.com/r/SuicideWatch/comments/aapz9b/do_people_react_more_to_losing_someone_by_suicide/,12/29/2018/22:53:55,aapz9b,SuicideWatch
I will destroy my life...,[deleted],,0,2,https://www.reddit.com/r/SuicideWatch/comments/aapwh7/i_will_destroy_my_life/,12/29/2018/22:45:16,aapwh7,SuicideWatch
suicide is a great motivator,"if i kill myself, i wouldn’t want whoever found my body to see my house the way it is, so i’ve incorporated cleaning my house into my suicide plan. 

now, at least i’m stuck with a clean house when i’m too much of a coward to do it. ",hbabygirl,86,11,https://www.reddit.com/r/SuicideWatch/comments/aapvv8/suicide_is_a_great_motivator/,12/29/2018/22:43:32,aapvv8,SuicideWatch
Will to live in spite of others,[deleted],,1,0,https://www.reddit.com/r/SuicideWatch/comments/aapvaw/will_to_live_in_spite_of_others/,12/29/2018/22:41:50,aapvaw,SuicideWatch
Done trying i cant deal with it anymore.,[deleted],,1,0,https://www.reddit.com/r/SuicideWatch/comments/aaps65/done_trying_i_cant_deal_with_it_anymore/,12/29/2018/22:31:46,aaps65,SuicideWatch
697 Days in Hell - Suicide or ???,[removed],appydave,5,1,https://www.reddit.com/r/SuicideWatch/comments/aapqsk/697_days_in_hell_suicide_or/,12/29/2018/22:27:20,aapqsk,SuicideWatch
Considering suicide after recurring academic faliure.,[deleted],,3,7,https://www.reddit.com/r/SuicideWatch/comments/aaposm/considering_suicide_after_recurring_academic/,12/29/2018/22:21:14,aaposm,SuicideWatch
I will kill myself...,[deleted],,1,4,https://www.reddit.com/r/SuicideWatch/comments/aapk98/i_will_kill_myself/,12/29/2018/22:06:40,aapk98,SuicideWatch
My (20f) little brother (15m) tried to commit suicide today.,[deleted],,1,0,https://www.reddit.com/r/SuicideWatch/comments/aaphvu/my_20f_little_brother_15m_tried_to_commit_suicide/,12/29/2018/21:59:33,aaphvu,SuicideWatch
I’m worthless,[deleted],,2,2,https://www.reddit.com/r/SuicideWatch/comments/aapgnh/im_worthless/,12/29/2018/21:55:43,aapgnh,SuicideWatch
Waiting for my parents to die so I can,[deleted],,1,0,https://www.reddit.com/r/SuicideWatch/comments/aapejd/waiting_for_my_parents_to_die_so_i_can/,12/29/2018/21:49:11,aapejd,SuicideWatch
I’m done with people who give useless advice,"Hey folks it’s me

I’ve never posted here before but I thought what the hell let’s see 

Ok bit of backstory depression anxiety and abandonment issues with some divorced parents and extreme mental health problems in my genetics.

I’ve been trying to kill myself since the 4th grade I always try around the same time after thanks giving before Christmas. Obviously I’ve failed every time whether I wasn’t brave enough or hoodie strings aren’t super sturdy. My family has a big problem with standing out whether it be mental health or homosexuality guess what I’m both. 

I told my mother that I’ve thought about and tried killing myself since 4th grade. She said we’d go see someone but we never did. My dad used to be my hero sadly I’ve grown up a bit and now I realize he’s a lazy drug addict who can’t even keep the promise of eating dinner with me. On the other hand my mother has extremely severe OCD not like did I leave the curling iron on more like spending an hour moving every pine cone off the side walk every day causing me to be late to school.

At least I’ve got my suicide note down

You would say I was a smiling bright boy with lots of friends but deep down you knew you just didn’t care.        -M",ucnthatethsname,2,5,https://www.reddit.com/r/SuicideWatch/comments/aapeiy/im_done_with_people_who_give_useless_advice/,12/29/2018/21:49:09,aapeiy,SuicideWatch
My sugar addiction is the only thing keeping me alive right now but its slowly killing me,[deleted],,2,2,https://www.reddit.com/r/SuicideWatch/comments/aapdvc/my_sugar_addiction_is_the_only_thing_keeping_me/,12/29/2018/21:47:01,aapdvc,SuicideWatch
I will kill myself...,[deleted],,0,1,https://www.reddit.com/r/SuicideWatch/comments/aapd4y/i_will_kill_myself/,12/29/2018/21:44:50,aapd4y,SuicideWatch
I'm gonna slit my throat before I go to sleep,[deleted],,2,2,https://www.reddit.com/r/SuicideWatch/comments/aapcp9/im_gonna_slit_my_throat_before_i_go_to_sleep/,12/29/2018/21:43:19,aapcp9,SuicideWatch
Great now i ruined my SO's birthday,"I deserve to be dead, you feel me?",,1,4,https://www.reddit.com/r/SuicideWatch/comments/aapa5y/great_now_i_ruined_my_sos_birthday/,12/29/2018/21:35:34,aapa5y,SuicideWatch
I just want to die,[deleted],,1,0,https://www.reddit.com/r/SuicideWatch/comments/aap8jy/i_just_want_to_die/,12/29/2018/21:30:44,aap8jy,SuicideWatch
My gf keeps setting herself to invisible so i don't know if she's okay.,[deleted],,1,0,https://www.reddit.com/r/SuicideWatch/comments/aap8f0/my_gf_keeps_setting_herself_to_invisible_so_i/,12/29/2018/21:30:17,aap8f0,SuicideWatch
Does anyone else get this feeling with drugs?,"I took a lot of drugs the other day and I got so fucked. It was really overwhelming. I was just having a lot of deep thoughts and I decided that I do really want to do. It felt like I was going to overdose and I really hope I did. I just put some music on, put my fav  songs on and close my eyes and thought about my life and was ready to die. Well I didn't end up dying unfortunately.",IAmBatman412,1,1,https://www.reddit.com/r/SuicideWatch/comments/aap8a7/does_anyone_else_get_this_feeling_with_drugs/,12/29/2018/21:29:53,aap8a7,SuicideWatch
Did something I can't forgive myself for with potential legal ramifications,[deleted],,1,1,https://www.reddit.com/r/SuicideWatch/comments/aap5kq/did_something_i_cant_forgive_myself_for_with/,12/29/2018/21:21:37,aap5kq,SuicideWatch
A friend is thinking about suicide,"Hi Reddit, I believe I have a serious problem in hand right now. A friend of mine is going through a period of deep stress, induced by university exams, relationship problems. She's a foreign student so reliance on her family is quite restricted due to geographical distance. Through her words I have learned that the thought of commiting suicide did cross her mind some odd times before this happened. Recently, sometimes she just breaks down and cries just because of trivial incidents. She tried to cut herself(this also have happened before), saying she's had enough of everything, that she doesn't want to try anymore. I suggested visiting  a psychotherapist, but she flat out refused, saying she's fine. What do I do now? We live in Germany. Thanks for your help? ",ZhaiNo1,0,1,https://www.reddit.com/r/SuicideWatch/comments/aap58w/a_friend_is_thinking_about_suicide/,12/29/2018/21:20:38,aap58w,SuicideWatch
Please help,[deleted],,1,4,https://www.reddit.com/r/SuicideWatch/comments/aap3hf/please_help/,12/29/2018/21:15:06,aap3hf,SuicideWatch
I honestly feel the only way to truly show my parents how I feel and just how hopeless I am is to kill myself,"We just had a conversation, that lead to no where. Literally everything in my life is the same. All talk but no action. Nothing changes. 

I have to post this because I have no one to talk too otherwise. 

Edit: about to go get food by myself again. I hope I get into a car crash and I die. ",JJ32Moose18,1,2,https://www.reddit.com/r/SuicideWatch/comments/aap31m/i_honestly_feel_the_only_way_to_truly_show_my/,12/29/2018/21:13:38,aap31m,SuicideWatch
Any advice?,[deleted],,1,0,https://www.reddit.com/r/SuicideWatch/comments/aap05r/any_advice/,12/29/2018/21:04:56,aap05r,SuicideWatch
Help! Who wants to be my pact partner?,"I live a healthy lifestyle for ten years now: clean eating, no drinking, no smoking, and no drugs. But still slipping away very fast now and January will be my last month if things don’t change. I am so scared. Who lives a bit likeminded lifestyle and wants to be my pact partner, by which I mean keep eachother in check by talking a lot by being positive and supportive to eachother?",throwawayworld99,2,1,https://www.reddit.com/r/SuicideWatch/comments/aaoz5h/help_who_wants_to_be_my_pact_partner/,12/29/2018/21:01:57,aaoz5h,SuicideWatch
I'm going into 2019 feeling sure that it'll be my last year. And at this point I am honestly okay with that.,[deleted],,24,7,https://www.reddit.com/r/SuicideWatch/comments/aaowvs/im_going_into_2019_feeling_sure_that_itll_be_my/,12/29/2018/20:55:22,aaowvs,SuicideWatch
I’m just about ready to off myself,[deleted],,1,0,https://www.reddit.com/r/SuicideWatch/comments/aaowuh/im_just_about_ready_to_off_myself/,12/29/2018/20:55:17,aaowuh,SuicideWatch
This is it,[deleted],,2,0,https://www.reddit.com/r/SuicideWatch/comments/aaoud1/this_is_it/,12/29/2018/20:47:35,aaoud1,SuicideWatch
I want to end my life,[deleted],,1,0,https://www.reddit.com/r/SuicideWatch/comments/aaosm9/i_want_to_end_my_life/,12/29/2018/20:42:26,aaosm9,SuicideWatch
I'll die before I turn 20,"Fuck this shit. I failed everyone including myself, and I keep on failing. What's the fucking point in going further. I am already a sore loser and I am ashamed of even talking about the way I live my life. I don't belong here. If you can't play the game, don't play it. I don't have a plan yet. Probably will rent a hotel room or something. ",RobCrimson,1,1,https://www.reddit.com/r/SuicideWatch/comments/aaor2f/ill_die_before_i_turn_20/,12/29/2018/20:37:43,aaor2f,SuicideWatch
How long does it take to bleed out if you cut your wrist?,[deleted],,2,3,https://www.reddit.com/r/SuicideWatch/comments/aaopxo/how_long_does_it_take_to_bleed_out_if_you_cut/,12/29/2018/20:34:17,aaopxo,SuicideWatch
i'm a shitty person,"everything i do seems to be abusive, even though i try not too. i only hurt. i put the idea of cutting in her head and now she might commit suicide bc of me. i should go away and try and hide my death from her. i only want to keep her safe but if i do i have to go away and die. i can't treat her the way she deserves and now i need to go. i never meant to threaten to hurt myself, or to guilt trip, but i can't be forgiven for it. ",,4,6,https://www.reddit.com/r/SuicideWatch/comments/aaoghx/im_a_shitty_person/,12/29/2018/20:05:15,aaoghx,SuicideWatch
One step closer to going,[deleted],,1,0,https://www.reddit.com/r/SuicideWatch/comments/aaobcm/one_step_closer_to_going/,12/29/2018/19:49:39,aaobcm,SuicideWatch
Can someone talk please? :(,[deleted],,1,13,https://www.reddit.com/r/SuicideWatch/comments/aaoaqe/can_someone_talk_please/,12/29/2018/19:47:48,aaoaqe,SuicideWatch
I wanna die,[deleted],,2,1,https://www.reddit.com/r/SuicideWatch/comments/aao9ju/i_wanna_die/,12/29/2018/19:44:10,aao9ju,SuicideWatch
I don’t know what to title this. I think it’s basically my life and why I want to die.,[deleted],,3,2,https://www.reddit.com/r/SuicideWatch/comments/aao3l7/i_dont_know_what_to_title_this_i_think_its/,12/29/2018/19:25:44,aao3l7,SuicideWatch
Feel so trapped and trapped and hemmed in,"Anyone else feel that people telling you how much youd be missed and how much it would hurt them if u did it is just wholeheartedly unhelpful, especially those close to you. I think its ultimately whats going to lead to me actually doing something. I think ill just snap and just not care.",anondescriptUn,2,0,https://www.reddit.com/r/SuicideWatch/comments/aao23e/feel_so_trapped_and_trapped_and_hemmed_in/,12/29/2018/19:21:21,aao23e,SuicideWatch
